[
    {
        "appFingerprint": "68CFA9B6D40E0BF02F410A66557A57E4",
        "appFlavor": "studioapp.retail",
        "appName": "Studio One",
        "appVersion": "6.1.1",
        "architecture": "x64",
        "buildNumber": 92984,
        "lastTimestamp": 1682791200,
        "platform": "win",
        "timestamp": 1684362398,
        "event": "FileExportReport"
    },
    {
        "appFingerprint": "68CFA9B6D40E0BF02F410A66557A57E4",
        "appFlavor": "studioapp.retail",
        "appName": "Studio One",
        "appVersion": "6.1.1",
        "architecture": "x64",
        "buildNumber": 92984,
        "exports": [
            {
                "context": "DigitalRelease",
                "count": 1,
                "type": "mp3"
            }
        ],
        "lastTimestamp": 0,
        "platform": "win",
        "timestamp": 1684362402,
        "event": "FileExportReport"
    },
    {
        "appFingerprint": "68CFA9B6D40E0BF02F410A66557A57E4",
        "appFlavor": "studioapp.retail",
        "appName": "Studio One",
        "appVersion": "6.1.1",
        "architecture": "x64",
        "buildNumber": 92984,
        "lastTimestamp": 0,
        "platform": "win",
        "timestamp": 1684362393,
        "event": "FileExportReport"
    },
    {
        "appFingerprint": "877539B055AFBEC017ADA428CF808A52",
        "appFlavor": "studioapp.retail",
        "appName": "Studio One",
        "appVersion": "6.1.1",
        "architecture": "ARM64",
        "buildNumber": 92984,
        "lastTimestamp": 0,
        "platform": "mac",
        "timestamp": 1684362465,
        "event": "FileExportReport"
    },
    {
        "appFingerprint": "68CFA9B6D40E0BF02F410A66557A57E4",
        "appFlavor": "studioapp.retail",
        "appName": "Studio One",
        "appVersion": "6.1.1",
        "architecture": "x64",
        "buildNumber": 92984,
        "exports": [
            {
                "context": "Mixdown",
                "count": 1,
                "type": "wav"
            }
        ],
        "lastTimestamp": 0,
        "platform": "win",
        "timestamp": 1684362499,
        "event": "FileExportReport"
    },
    {
        "appFingerprint": "68CFA9B6D40E0BF02F410A66557A57E4",
        "appFlavor": "studioapp.retail",
        "appName": "Studio One",
        "appVersion": "6.1.1",
        "architecture": "x64",
        "buildNumber": 92984,
        "exports": [
            {
                "context": "Mixdown",
                "count": 1,
                "type": "mp3"
            }
        ],
        "lastTimestamp": 1683223200,
        "platform": "win",
        "timestamp": 1684362592,
        "event": "FileExportReport"
    },
    {
        "appFingerprint": "877539B055AFBEC017ADA428CF808A52",
        "appFlavor": "studioapp.retail",
        "appName": "Studio One",
        "appVersion": "6.1.1",
        "architecture": "x64",
        "buildNumber": 92984,
        "exports": [
            {
                "context": "Mixdown",
                "count": 5,
                "type": "wav"
            },
            {
                "context": "Stem",
                "count": 2,
                "type": "wav"
            },
            {
                "context": "Mixdown",
                "count": 5,
                "type": "mp3"
            }
        ],
        "lastTimestamp": 0,
        "platform": "mac",
        "timestamp": 1684362650,
        "event": "FileExportReport"
    }
]